sipp/result/idea_scan/paid_sick_leave_estimates.csv

model,outcome,term,coef,se,t,n_person_years,n_persons,n_states,weighted_mean
paid_sick_leave_clean_worker_low_educ,sick_days,clean_treat,0.6848715781717019,0.680826228943092,1.0059418234148967,121623,69936,52,3.6281358955364618
paid_sick_leave_clean_worker_low_educ,sick_any,clean_treat,-0.01768120508624449,0.021991227688270686,-0.8040117330818686,123078,70330,52,0.43505516746514217
paid_sick_leave_clean_worker_low_educ,doctor_any,clean_treat,-0.014273091005431837,0.020576329760440017,-0.6936655453915418,123078,70330,52,0.7171333332731623
paid_sick_leave_clean_worker_low_educ,doctor_visits,clean_treat,-0.02794805854144755,0.39747575200421137,-0.0703138704701449,121623,69936,52,3.8820313949513574
paid_sick_leave_clean_worker_low_educ,hospital_any,clean_treat,0.004665664536460112,0.011300861263071007,0.4128591996529138,123078,70330,52,0.059831455442131566
paid_sick_leave_clean_worker_low_educ,oop_any,clean_treat,-0.0009059744196466823,0.02156539538371588,-0.04201056384668873,123078,70330,52,0.5993839655753511
paid_sick_leave_clean_worker_low_educ,any_coverage,clean_treat,-0.008799187736704184,0.01590018725750123,-0.5534015162339042,123078,70330,52,0.8686327459922876
paid_sick_leave_clean_worker_low_educ,uninsured,clean_treat,0.008799187735929137,0.015900187257500677,0.553401516185179,123078,70330,52,0.13136725400771254
paid_sick_leave_clean_worker_low_educ,private,clean_treat,-0.015759276095165475,0.019017929043599377,-0.8286536383134406,123078,70330,52,0.7646087281948333
paid_sick_leave_clean_worker_low_educ,public,clean_treat,0.011066322990859634,0.018002598302724826,0.6147069886675561,123078,70330,52,0.14428636574669848
paid_sick_leave_clean_worker_low_educ,earnings_positive,clean_treat,0.003668068721990103,0.007089020853302645,0.51742952911208,123078,70330,52,0.9742437721245928
paid_sick_leave_clean_worker_low_educ,log_earnings,clean_treat,0.012369476686316716,0.0818497911768036,0.1511241080578621,123078,70330,52,10.216590145789107
paid_sick_leave_clean_worker_low_income,sick_days,clean_treat,-1.6481650724368642,0.9942821459220264,-1.6576432345654497,121623,69936,52,3.6281358955364618
paid_sick_leave_clean_worker_low_income,sick_any,clean_treat,-0.03118402545838217,0.023705030976218733,-1.3155024133765734,123078,70330,52,0.43505516746514217
paid_sick_leave_clean_worker_low_income,doctor_any,clean_treat,0.02115195302891859,0.021975209231290805,0.9625370482843928,123078,70330,52,0.7171333332731623
paid_sick_leave_clean_worker_low_income,doctor_visits,clean_treat,-0.2726040702574828,0.4699375171203263,-0.5800857780581993,121623,69936,52,3.8820313949513574
paid_sick_leave_clean_worker_low_income,hospital_any,clean_treat,-0.014540525686148886,0.01241097818681702,-1.1715857901993478,123078,70330,52,0.059831455442131566
paid_sick_leave_clean_worker_low_income,oop_any,clean_treat,0.00214669731893391,0.023616231973806363,0.09089923072041685,123078,70330,52,0.5993839655753511
paid_sick_leave_clean_worker_low_income,any_coverage,clean_treat,-0.01717512424543255,0.016811032637358943,-1.021657896687708,123078,70330,52,0.8686327459922876
paid_sick_leave_clean_worker_low_income,uninsured,clean_treat,0.017175124249679152,0.016811032637362597,1.021657896940094,123078,70330,52,0.13136725400771254
paid_sick_leave_clean_worker_low_income,private,clean_treat,0.0376289811383721,0.02168092580220786,1.735579996982425,123078,70330,52,0.7646087281948333
paid_sick_leave_clean_worker_low_income,public,clean_treat,-0.059427623360649884,0.021559297964747218,-2.7564730288445953,123078,70330,52,0.14428636574669848
paid_sick_leave_clean_worker_low_income,earnings_positive,clean_treat,0.007256579109958139,0.010163195805042087,0.7140056384978887,123078,70330,52,0.9742437721245928
paid_sick_leave_clean_worker_low_income,log_earnings,clean_treat,-0.017845923091712734,0.11375380486707476,-0.15688198836571937,123078,70330,52,10.216590145789107
paid_sick_leave_clean_worker_low_educ_or_income,sick_days,clean_treat,-0.2017621252749393,0.682009380438593,-0.2958348243614893,121623,69936,52,3.6281358955364618
paid_sick_leave_clean_worker_low_educ_or_income,sick_any,clean_treat,-0.022217336265281773,0.020795801039041738,-1.068356839131672,123078,70330,52,0.43505516746514217
paid_sick_leave_clean_worker_low_educ_or_income,doctor_any,clean_treat,-0.023315730855103967,0.018767360026226414,-1.2423553884255132,123078,70330,52,0.7171333332731623
paid_sick_leave_clean_worker_low_educ_or_income,doctor_visits,clean_treat,-0.3091291283451767,0.39110802404057665,-0.7903932145179031,121623,69936,52,3.8820313949513574
paid_sick_leave_clean_worker_low_educ_or_income,hospital_any,clean_treat,-0.0062960205212642395,0.010130718753723435,-0.6214781669810157,123078,70330,52,0.059831455442131566
paid_sick_leave_clean_worker_low_educ_or_income,oop_any,clean_treat,-0.01675888216599475,0.02004841225233633,-0.8359206681836743,123078,70330,52,0.5993839655753511
paid_sick_leave_clean_worker_low_educ_or_income,any_coverage,clean_treat,-0.024250892933399326,0.013559773247513392,-1.7884438397851885,123078,70330,52,0.8686327459922876
paid_sick_leave_clean_worker_low_educ_or_income,uninsured,clean_treat,0.024250892935041568,0.013559773247512629,1.7884438399064004,123078,70330,52,0.13136725400771254
paid_sick_leave_clean_worker_low_educ_or_income,private,clean_treat,-0.0029170736894892357,0.01750858062963309,-0.1666082334825085,123078,70330,52,0.7646087281948333
paid_sick_leave_clean_worker_low_educ_or_income,public,clean_treat,-0.017740040199015317,0.016369044673454326,-1.0837553780877838,123078,70330,52,0.14428636574669848
paid_sick_leave_clean_worker_low_educ_or_income,earnings_positive,clean_treat,0.004835046305687651,0.006671293765728577,0.7247539196259052,123078,70330,52,0.9742437721245928
paid_sick_leave_clean_worker_low_educ_or_income,log_earnings,clean_treat,-0.014823432544879722,0.0801462853986906,-0.1849547046521248,123078,70330,52,10.216590145789107
paid_sick_leave_clean_all_adults_worker_target,sick_days,clean_treat,-1.3415795685314413,1.5210974229387644,-0.8819813565521043,172363,94764,52,6.700370336583169
paid_sick_leave_clean_all_adults_worker_target,sick_any,clean_treat,-0.0069757342002840375,0.019112514771088034,-0.36498254069822356,174509,94933,52,0.4407586588241242
paid_sick_leave_clean_all_adults_worker_target,doctor_any,clean_treat,-0.00482746721219612,0.016963991872935822,-0.284571417409001,174509,94933,52,0.7228580759392611
paid_sick_leave_clean_all_adults_worker_target,doctor_visits,clean_treat,-0.22457127671805,0.5219139714244925,-0.4302840870596232,172363,94764,52,4.611971641245121
paid_sick_leave_clean_all_adults_worker_target,hospital_any,clean_treat,-0.010605014419149059,0.011961863653894433,-0.8865687426303657,174509,94933,52,0.07861768985888194
paid_sick_leave_clean_all_adults_worker_target,oop_any,clean_treat,0.013920104556951994,0.01816850288792222,0.7661668461525021,174509,94933,52,0.5390223982715148
paid_sick_leave_clean_all_adults_worker_target,any_coverage,clean_treat,0.012888438964358522,0.012222733822403844,1.0544645045558028,174509,94933,52,0.8611036881026873
paid_sick_leave_clean_all_adults_worker_target,uninsured,clean_treat,-0.012888438966052693,0.012222733822405069,-1.0544645046943053,174509,94933,52,0.13889631189731272
paid_sick_leave_clean_all_adults_worker_target,private,clean_treat,0.013342113597113667,0.01668306884265899,0.7997397674819621,174509,94933,52,0.6852923728737944
paid_sick_leave_clean_all_adults_worker_target,public,clean_treat,-0.0001764493487852758,0.017072762804647704,-0.010335137364951919,174509,94933,52,0.22891013602734422
paid_sick_leave_clean_all_adults_worker_target,earnings_positive,clean_treat,-0.008003798528629182,0.012566477555243726,-0.6369166294567061,174509,94933,52,0.7466044243797236
paid_sick_leave_clean_all_adults_worker_target,log_earnings,clean_treat,-0.09689275055725365,0.11273887887986572,-0.8594439781550633,174509,94933,52,7.740363452076867
paid_sick_leave_clean_all_adults_worker_target,employed_share,clean_treat,-0.00451330589144648,0.004102595356438351,-1.1001099302575834,174509,94933,52,0.7157757278509229
paid_sick_leave_broad_worker_low_educ,sick_days,broad_treat,0.13646428127611188,0.6197680034169831,0.22018607047111144,121623,69936,52,3.6281358955364618
paid_sick_leave_broad_worker_low_educ,sick_any,broad_treat,-0.015112924600597655,0.018924724977882144,-0.7985809367512898,123078,70330,52,0.43505516746514217
paid_sick_leave_broad_worker_low_educ,doctor_any,broad_treat,0.0031649580945396494,0.01758111283285242,0.18002035051077914,123078,70330,52,0.7171333332731623
paid_sick_leave_broad_worker_low_educ,doctor_visits,broad_treat,-0.16988752307430488,0.3354560646361891,-0.5064374771657575,121623,69936,52,3.8820313949513574
paid_sick_leave_broad_worker_low_educ,hospital_any,broad_treat,-0.005664194262628264,0.009640139391780817,-0.5875635229359397,123078,70330,52,0.059831455442131566
paid_sick_leave_broad_worker_low_educ,oop_any,broad_treat,0.009919564154293958,0.0185361145155425,0.5351479753740419,123078,70330,52,0.5993839655753511
paid_sick_leave_broad_worker_low_educ,any_coverage,broad_treat,-0.006608792447586609,0.01349546607003244,-0.48970464697487276,123078,70330,52,0.8686327459922876
paid_sick_leave_broad_worker_low_educ,uninsured,broad_treat,0.006608792446835876,0.013495466070031825,0.4897046469192665,123078,70330,52,0.13136725400771254
paid_sick_leave_broad_worker_low_educ,private,broad_treat,-0.012812910973081237,0.01616625551063661,-0.7925713511487533,123078,70330,52,0.7646087281948333
paid_sick_leave_broad_worker_low_educ,public,broad_treat,0.013217508934510791,0.015101310669326198,0.8752557459372193,123078,70330,52,0.14428636574669848
paid_sick_leave_broad_worker_low_educ,earnings_positive,broad_treat,-0.002869237659633761,0.006057374751643363,-0.4736767621741313,123078,70330,52,0.9742437721245928
paid_sick_leave_broad_worker_low_educ,log_earnings,broad_treat,-0.07076952030133299,0.06967388371829063,-1.0157252118666487,123078,70330,52,10.216590145789107

sipp/report/32_paid_sick_leave_fast_test.md

## Main Estimates

- `sick_days`: +0.6849, se 0.6808, t 1.01.
- `sick_any`: -0.0177, se 0.0220, t -0.80.
- `doctor_any`: -0.0143, se 0.0206, t -0.69.
- `doctor_visits`: -0.0279, se 0.3975, t -0.07.
- `uninsured`: +0.0088, se 0.0159, t 0.55.
- `log_earnings`: +0.0124, se 0.0818, t 0.15.

- `sick_days`: -1.6482, se 0.9943, t -1.66.
- `sick_any`: -0.0312, se 0.0237, t -1.32.
- `doctor_any`: +0.0212, se 0.0220, t 0.96.
- `doctor_visits`: -0.2726, se 0.4699, t -0.58.
- `uninsured`: +0.0172, se 0.0168, t 1.02.
- `log_earnings`: -0.0178, se 0.1138, t -0.16.

- `sick_days`: -1.3416, se 1.5211, t -0.88.
- `sick_any`: -0.0070, se 0.0191, t -0.36.
- `doctor_any`: -0.0048, se 0.0170, t -0.28.
- `doctor_visits`: -0.2246, se 0.5219, t -0.43.
- `uninsured`: -0.0129, se 0.0122, t -1.05.
- `log_earnings`: -0.0969, se 0.1127, t -0.86.
- `employed_share`: -0.0045, se 0.0041, t -1.10.

- `sick_days`: +0.1365, se 0.6198, t 0.22.
- `sick_any`: -0.0151, se 0.0189, t -0.80.
- `doctor_any`: +0.0032, se 0.0176, t 0.18.
- `doctor_visits`: -0.1699, se 0.3355, t -0.51.
- `uninsured`: +0.0066, se 0.0135, t 0.49.
- `log_earnings`: -0.0708, se 0.0697, t -1.02.