sipp/result/idea_scan/snap_ea_estimates.csv

model,outcome,term,coef,se,t,n_person_years,n_persons,n_states,weighted_mean
snap_ea_early_end_lag_snap_2018_2022,food_insecure,ea_end_treat,0.06617201523807892,0.041955283873612574,1.5772033729390937,27622,18831,50,0.2010022079298378
snap_ea_early_end_lag_snap_2018_2022,very_low_food,ea_end_treat,0.009722314962459011,0.035059198226993785,0.277311389139907,27622,18831,50,0.08566329270991299
snap_ea_early_end_lag_snap_2018_2022,food_score,ea_end_treat,0.10358408344858105,0.1956326034218065,0.5294827223928611,27622,18831,50,0.861917625918678
snap_ea_early_end_lag_snap_2018_2022,snap_any,ea_end_treat,-0.008985445085291754,0.03521232240718313,-0.25517899618739065,27622,18831,50,0.21961143144226986
snap_ea_early_end_lag_snap_2018_2022,snap_share,ea_end_treat,-0.027538854282762815,0.03515008630893451,-0.7834647699218578,27622,18831,50,0.1895811074865586
snap_ea_early_end_lag_snap_2018_2022,doctor_any,ea_end_treat,0.04654905716385671,0.037694229388948904,1.234912025486422,27622,18831,50,0.6727474825428243
snap_ea_early_end_lag_snap_2018_2022,doctor_visits,ea_end_treat,-1.2453073321306647,1.2227056644999934,-1.0184849619061134,26803,18189,50,5.158533605558365
snap_ea_early_end_lag_snap_2018_2022,dental_any,ea_end_treat,-0.03125559117401511,0.04359750862690002,-0.716912322708508,27622,18831,50,0.5377351237163593
snap_ea_early_end_lag_snap_2018_2022,oop_any,ea_end_treat,0.027191386034019494,0.04259712410083262,0.6383385406407753,27622,18831,50,0.4508465539460057
snap_ea_early_end_lag_snap_2018_2022,sick_days,ea_end_treat,-9.304160159888156,4.146206339325643,-2.2440176388812874,26803,18189,50,9.781152407852922
snap_ea_early_end_lag_snap_2018_2022,any_coverage,ea_end_treat,0.005941529289177794,0.02849553302281366,0.20850739252432923,27622,18831,50,0.8247970378263865
snap_ea_early_end_lag_snap_2018_2022,uninsured,ea_end_treat,-0.005941529288933517,0.028495533022812266,-0.20850739251576697,27622,18831,50,0.17520296217361345
snap_ea_early_end_lag_snap_2018_2022,public,ea_end_treat,-0.05793392851172685,0.03879867467834309,-1.4931934915824536,27622,18831,50,0.41424177271133106
snap_ea_early_end_lag_snap_2018_2022,private,ea_end_treat,0.04985822641437543,0.040759793287208024,1.2232207867948839,27622,18831,50,0.4931700183297667
snap_ea_early_end_lag_snap_2018_2022,employed_share,ea_end_treat,0.05731478139884849,0.038904535405584625,1.4732159323157252,27622,18831,50,0.5818912866768773
snap_ea_early_end_lag_snap_2018_2022,log_earnings,ea_end_treat,0.5545223492199423,0.40471620604659275,1.370151085958992,27622,18831,50,6.054337131161405
snap_ea_early_end_lag_snap_2018_2023_including_federal_cliff,food_insecure,ea_end_treat,0.038666485297287334,0.033925107227697225,1.1397601498432153,31702,21116,50,0.20775461948403853
snap_ea_early_end_lag_snap_2018_2023_including_federal_cliff,very_low_food,ea_end_treat,0.005279337273996543,0.027451559553487947,0.19231465752282767,31702,21116,50,0.08798879318589808
snap_ea_early_end_lag_snap_2018_2023_including_federal_cliff,food_score,ea_end_treat,0.03451641908215031,0.1555944746264218,0.22183576354509574,31702,21116,50,0.8856396948211557
snap_ea_early_end_lag_snap_2018_2023_including_federal_cliff,snap_any,ea_end_treat,-0.019141003024271352,0.028664576853486473,-0.6677580876950302,31702,21116,50,0.21911260485724976
snap_ea_early_end_lag_snap_2018_2023_including_federal_cliff,snap_share,ea_end_treat,-0.04110048955077161,0.0288991557752625,-1.4222038135090915,31702,21116,50,0.18839925721874767
snap_ea_early_end_lag_snap_2018_2023_including_federal_cliff,doctor_any,ea_end_treat,0.019291974082646934,0.03168314127900217,0.6089034516104812,31702,21116,50,0.6782404928919465
snap_ea_early_end_lag_snap_2018_2023_including_federal_cliff,doctor_visits,ea_end_treat,-0.34168106925981334,0.9871431460583148,-0.3461312279016004,30780,20398,50,5.1666671559972785
snap_ea_early_end_lag_snap_2018_2023_including_federal_cliff,dental_any,ea_end_treat,-0.04725757456669566,0.03644549681153494,-1.2966642987766521,31702,21116,50,0.546967644768842
snap_ea_early_end_lag_snap_2018_2023_including_federal_cliff,oop_any,ea_end_treat,0.02169727310685876,0.03591661226683576,0.6041013263072509,31702,21116,50,0.4517126124967132
snap_ea_early_end_lag_snap_2018_2023_including_federal_cliff,sick_days,ea_end_treat,-3.305720797472887,3.7530061550946177,-0.8808194446964731,30780,20398,50,9.87771113181891
snap_ea_early_end_lag_snap_2018_2023_including_federal_cliff,any_coverage,ea_end_treat,-0.023282262616297178,0.02492534092010606,-0.9340800068061058,31702,21116,50,0.8281064418511547
snap_ea_early_end_lag_snap_2018_2023_including_federal_cliff,uninsured,ea_end_treat,0.023282262616946492,0.024925340920108,0.9340800068320835,31702,21116,50,0.1718935581488453
snap_ea_early_end_lag_snap_2018_2023_including_federal_cliff,public,ea_end_treat,-0.07368133059849802,0.03153113013135909,-2.336780517905342,31702,21116,50,0.41566166588163606
snap_ea_early_end_lag_snap_2018_2023_including_federal_cliff,private,ea_end_treat,0.011357863965935633,0.03234783595054918,0.3511166553242894,31702,21116,50,0.495291626326846
snap_ea_early_end_lag_snap_2018_2023_including_federal_cliff,employed_share,ea_end_treat,0.0531732151308284,0.03218593698555134,1.6520636063725131,31702,21116,50,0.5838137323938845
snap_ea_early_end_lag_snap_2018_2023_including_federal_cliff,log_earnings,ea_end_treat,0.579693461449514,0.3332360647402426,1.7395880061822986,31702,21116,50,6.067425701383024
snap_ea_early_end_current_snap_2018_2022,food_insecure,ea_end_treat,0.1262678599005348,0.030540867918457535,4.13439003232204,56227,39158,51,0.20270548681634523
snap_ea_early_end_current_snap_2018_2022,very_low_food,ea_end_treat,0.08135944176343024,0.0263721108784378,3.0850561086466097,56227,39158,51,0.08701508280474436
snap_ea_early_end_current_snap_2018_2022,food_score,ea_end_treat,0.513062803973928,0.14499805208352465,3.538411700030173,56227,39158,51,0.8723417729819347
snap_ea_early_end_current_snap_2018_2022,snap_any,ea_end_treat,2.877698079828406e-13,2.447463895715342e-14,11.757877551804764,56227,39158,51,0.20145074867305163
snap_ea_early_end_current_snap_2018_2022,snap_share,ea_end_treat,-0.02557864966476764,0.015589603553648123,-1.6407504896929839,56227,39158,51,0.175082662487044
snap_ea_early_end_current_snap_2018_2022,doctor_any,ea_end_treat,0.023546007980014272,0.027758951571840343,0.8482311703695672,56227,39158,51,0.6744426706855386
snap_ea_early_end_current_snap_2018_2022,doctor_visits,ea_end_treat,-0.6847986464754996,0.9212026687903053,-0.743374579423175,55296,38711,51,4.9254541472400675
snap_ea_early_end_current_snap_2018_2022,dental_any,ea_end_treat,-0.003945070468672984,0.03226645652565387,-0.12226537691042723,56227,39158,51,0.5425351104884495
snap_ea_early_end_current_snap_2018_2022,oop_any,ea_end_treat,-0.009493759886631259,0.030663974722885616,-0.30960630421945035,56227,39158,51,0.4535213177233363
snap_ea_early_end_current_snap_2018_2022,sick_days,ea_end_treat,-1.6813359831677346,3.3232491899743524,-0.5059313602603212,55296,38711,51,9.474901887342877
snap_ea_early_end_current_snap_2018_2022,any_coverage,ea_end_treat,-0.02227127426268627,0.02331855321330959,-0.9550881677330837,56227,39158,51,0.7916017866719212
snap_ea_early_end_current_snap_2018_2022,uninsured,ea_end_treat,0.022271274261889795,0.023318553213307055,0.9550881676990314,56227,39158,51,0.20839821332807898
snap_ea_early_end_current_snap_2018_2022,public,ea_end_treat,-0.000825930657568863,0.027681151952200115,-0.02983729358500261,56227,39158,51,0.3831623978306575
snap_ea_early_end_current_snap_2018_2022,private,ea_end_treat,-0.021510643490780634,0.02733446192838489,-0.786942268962074,56227,39158,51,0.4767800397334761
snap_ea_early_end_current_snap_2018_2022,employed_share,ea_end_treat,0.010007571866050946,0.02677590051202304,0.3737529522697957,56227,39158,51,0.568829272349412
snap_ea_early_end_current_snap_2018_2022,log_earnings,ea_end_treat,-0.1431188785820794,0.2721878131557787,-0.5258092819172969,56227,39158,51,5.933870903150307

sipp/report/34_snap_emergency_allotment_fast_test.md

## Main Estimates

- `food_insecure`: +0.0662, se 0.0420, t 1.58.
- `very_low_food`: +0.0097, se 0.0351, t 0.28.
- `food_score`: +0.1036, se 0.1956, t 0.53.
- `snap_any`: -0.0090, se 0.0352, t -0.26.
- `doctor_any`: +0.0465, se 0.0377, t 1.23.
- `oop_any`: +0.0272, se 0.0426, t 0.64.
- `uninsured`: -0.0059, se 0.0285, t -0.21.

- `food_insecure`: +0.0387, se 0.0339, t 1.14.
- `very_low_food`: +0.0053, se 0.0275, t 0.19.
- `food_score`: +0.0345, se 0.1556, t 0.22.
- `snap_any`: -0.0191, se 0.0287, t -0.67.
- `doctor_any`: +0.0193, se 0.0317, t 0.61.
- `oop_any`: +0.0217, se 0.0359, t 0.60.
- `uninsured`: +0.0233, se 0.0249, t 0.93.

- `food_insecure`: +0.1263, se 0.0305, t 4.13.
- `very_low_food`: +0.0814, se 0.0264, t 3.09.
- `food_score`: +0.5131, se 0.1450, t 3.54.
- `snap_any`: +0.0000, se 0.0000, t 11.76.
- `doctor_any`: +0.0235, se 0.0278, t 0.85.
- `oop_any`: -0.0095, se 0.0307, t -0.31.
- `uninsured`: +0.0223, se 0.0233, t 0.96.