sipp/result/idea_scan/snap_ea_household_estimates.csv

model,outcome,term,coef,se,t,n_household_years,n_households,n_states,weighted_mean
snap_ea_household_lag_snap_2018_2022,food_insecure,ea_end_treat,0.07634279667052676,0.04434782071754685,1.7214554274663747,19435,19449,51,0.2036805053874149
snap_ea_household_lag_snap_2018_2022,very_low_food,ea_end_treat,0.025794152646851035,0.03669790165466938,0.7028781342752612,19435,19449,51,0.08954247672873342
snap_ea_household_lag_snap_2018_2022,food_score,ea_end_treat,0.1611373716796892,0.20588747005675967,0.7826477815054329,19435,19449,51,0.8837649860053158
snap_ea_household_lag_snap_2018_2022,snap_any,ea_end_treat,-0.026566199479167052,0.03488719308994034,-0.7614885901161068,19435,19449,51,0.27931763115295727
snap_ea_household_lag_snap_2018_2022,snap_share,ea_end_treat,-0.024594188668273065,0.033907236119762145,-0.7253374642924328,19435,19449,51,0.2034055107490277
snap_ea_household_lag_snap_2018_2022,doctor_any,ea_end_treat,-0.007779581684133438,0.033623286247519986,-0.2313748164549874,19435,19449,51,0.6892734607198283
snap_ea_household_lag_snap_2018_2022,doctor_visits,ea_end_treat,-1.0240543992622797,1.2061741216675101,-0.8490104213532174,18930,18951,50,5.37802465587647
snap_ea_household_lag_snap_2018_2022,dental_any,ea_end_treat,0.018166713960085512,0.03881667781233078,0.4680131063229359,19435,19449,51,0.5397466530777685
snap_ea_household_lag_snap_2018_2022,oop_any,ea_end_treat,0.01911420501845258,0.035301801483454597,0.5414512635399389,19435,19449,51,0.400125382382101
snap_ea_household_lag_snap_2018_2022,sick_days,ea_end_treat,-6.169142074914966,4.106819586167313,-1.5021702184566414,18926,18947,50,10.571649023301793
snap_ea_household_lag_snap_2018_2022,any_coverage,ea_end_treat,0.02329766786388885,0.02503749749418903,0.9305110412610534,19435,19449,51,0.8497112789333013
snap_ea_household_lag_snap_2018_2022,uninsured,ea_end_treat,-0.023297667862617496,0.02503749749420517,-0.9305110412096756,19435,19449,51,0.15028872106669872
snap_ea_household_lag_snap_2018_2022,public,ea_end_treat,-0.029583612892052115,0.035612461155120574,-0.8307095868266999,19435,19449,51,0.4674458655062452
snap_ea_household_lag_snap_2018_2022,private,ea_end_treat,0.0672473290352196,0.03893139219518806,1.7273291614660367,19435,19449,51,0.4785209841946356
snap_ea_household_lag_snap_2018_2022,employed_share,ea_end_treat,0.05760243665376427,0.030653978284056416,1.8791178136811086,19435,19449,51,0.4683532408928368
snap_ea_household_lag_snap_2018_2022,log_earnings,ea_end_treat,0.6225457427244864,0.40707469089731674,1.5293157659892973,19435,19449,51,7.307176807681957
snap_ea_household_lag_snap_2018_2023_including_federal_cliff,food_insecure,ea_end_treat,0.04269390855488599,0.036534106020378196,1.1686041675981327,22295,22319,51,0.2101612392216946
snap_ea_household_lag_snap_2018_2023_including_federal_cliff,very_low_food,ea_end_treat,0.018530162151901442,0.029199536762030995,0.6346046618108253,22295,22319,51,0.09159381039703775
snap_ea_household_lag_snap_2018_2023_including_federal_cliff,food_score,ea_end_treat,0.06478910005209021,0.16691536486337363,0.38815539902586244,22295,22319,51,0.9070307457761178
snap_ea_household_lag_snap_2018_2023_including_federal_cliff,snap_any,ea_end_treat,-0.025048840723085393,0.028763654511681405,-0.8708504238539173,22295,22319,51,0.28023719913317596
snap_ea_household_lag_snap_2018_2023_including_federal_cliff,snap_share,ea_end_treat,-0.02465851244662844,0.02833142398955986,-0.8703590915767281,22295,22319,51,0.2031468031559846
snap_ea_household_lag_snap_2018_2023_including_federal_cliff,doctor_any,ea_end_treat,-0.018474899311128768,0.028325045576710478,-0.6522460576839907,22295,22319,51,0.6948075334543555
snap_ea_household_lag_snap_2018_2023_including_federal_cliff,doctor_visits,ea_end_treat,-0.3883267573255722,0.9296514832571686,-0.4177121903414957,21721,21752,50,5.397136217901003
snap_ea_household_lag_snap_2018_2023_including_federal_cliff,dental_any,ea_end_treat,-0.01255099075207326,0.03256758843382474,-0.3853828716110212,22295,22319,51,0.5474972019643383
snap_ea_household_lag_snap_2018_2023_including_federal_cliff,oop_any,ea_end_treat,0.0187910931077616,0.029727444928849173,0.6321126202651097,22295,22319,51,0.40140196516329013
snap_ea_household_lag_snap_2018_2023_including_federal_cliff,sick_days,ea_end_treat,-1.5309609318837545,3.5288099232882058,-0.4338462442480265,21716,21747,50,10.62655584156643
snap_ea_household_lag_snap_2018_2023_including_federal_cliff,any_coverage,ea_end_treat,0.0028501704591302394,0.021262070673596298,0.13404952428596914,22295,22319,51,0.8536810425607652
snap_ea_household_lag_snap_2018_2023_including_federal_cliff,uninsured,ea_end_treat,-0.0028501704584042702,0.021262070673596357,-0.13404952425182493,22295,22319,51,0.14631895743923481
snap_ea_household_lag_snap_2018_2023_including_federal_cliff,public,ea_end_treat,-0.06139553564201015,0.028763963109502723,-2.1344602413888842,22295,22319,51,0.47090054293864764
snap_ea_household_lag_snap_2018_2023_including_federal_cliff,private,ea_end_treat,0.04610080423123213,0.031180245079905862,1.4785260383005083,22295,22319,51,0.48065553632771285
snap_ea_household_lag_snap_2018_2023_including_federal_cliff,employed_share,ea_end_treat,0.04543418837870339,0.02629008008319436,1.728187523009741,22295,22319,51,0.47114083036731935
snap_ea_household_lag_snap_2018_2023_including_federal_cliff,log_earnings,ea_end_treat,0.6311100028980773,0.33443352125017495,1.8871015098572363,22295,22319,51,7.323512255175542
snap_ea_household_current_snap_2018_2022,food_insecure,ea_end_treat,0.10715717170643735,0.031747208990027385,3.375325740920979,40328,39188,51,0.2040275824856071
snap_ea_household_current_snap_2018_2022,very_low_food,ea_end_treat,0.054882781745876075,0.02706781840910235,2.027602702086258,40328,39188,51,0.09106576681841
snap_ea_household_current_snap_2018_2022,food_score,ea_end_treat,0.38537998128426576,0.14959372894136302,2.5761773839819515,40328,39188,51,0.8897217804967816
snap_ea_household_current_snap_2018_2022,snap_any,ea_end_treat,4.04121180963557e-13,1.6131685601593662e-14,25.051392082897618,40328,39188,51,0.250647528390988
snap_ea_household_current_snap_2018_2022,snap_share,ea_end_treat,-0.016202123570099536,0.018400914538271314,-0.8805064300690815,40328,39188,51,0.18385042810881275
snap_ea_household_current_snap_2018_2022,doctor_any,ea_end_treat,0.007388186572226285,0.024278033048686188,0.3043156979566802,40328,39188,51,0.6900294028299724
snap_ea_household_current_snap_2018_2022,doctor_visits,ea_end_treat,-0.8157835247759309,0.8439329066955509,-0.9666450002170908,39716,38589,51,5.030215335017912
snap_ea_household_current_snap_2018_2022,dental_any,ea_end_treat,0.015567997269607892,0.02807356739271106,0.5545428926731243,40328,39188,51,0.5503882926636328
snap_ea_household_current_snap_2018_2022,oop_any,ea_end_treat,0.00042827853041182973,0.025221731653684815,0.01698053632052102,40328,39188,51,0.40425789462177064
snap_ea_household_current_snap_2018_2022,sick_days,ea_end_treat,-1.7342312603697536,3.1620581750883052,-0.5484501436540846,39711,38584,51,10.097303882601981
snap_ea_household_current_snap_2018_2022,any_coverage,ea_end_treat,-0.0071045516226146965,0.020329834501116143,-0.34946431178397663,40328,39188,51,0.8173278454785545
snap_ea_household_current_snap_2018_2022,uninsured,ea_end_treat,0.00710455162369078,0.020329834501117108,0.3494643118368913,40328,39188,51,0.18267215452144545
snap_ea_household_current_snap_2018_2022,public,ea_end_treat,-0.006380523292309537,0.025410491694225,-0.2510979861818112,40328,39188,51,0.4247636883341301
snap_ea_household_current_snap_2018_2022,private,ea_end_treat,0.007470493448276994,0.026214634135346943,0.2849741640377894,40328,39188,51,0.47238360897334414
snap_ea_household_current_snap_2018_2022,employed_share,ea_end_treat,0.01176520874207776,0.020112771307582183,0.5849620901144772,40328,39188,51,0.46594218987040015
snap_ea_household_current_snap_2018_2022,log_earnings,ea_end_treat,-0.08522176931383996,0.24314614237345983,-0.35049607812795874,40328,39188,51,7.108142483374892

sipp/report/36_snap_ea_household_test.md

## Main Estimates

- `food_insecure`: +0.0763, se 0.0443, t 1.72.
- `very_low_food`: +0.0258, se 0.0367, t 0.70.
- `food_score`: +0.1611, se 0.2059, t 0.78.
- `snap_any`: -0.0266, se 0.0349, t -0.76.
- `doctor_any`: -0.0078, se 0.0336, t -0.23.
- `oop_any`: +0.0191, se 0.0353, t 0.54.
- `uninsured`: -0.0233, se 0.0250, t -0.93.

- `food_insecure`: +0.0427, se 0.0365, t 1.17.
- `very_low_food`: +0.0185, se 0.0292, t 0.63.
- `food_score`: +0.0648, se 0.1669, t 0.39.
- `snap_any`: -0.0250, se 0.0288, t -0.87.
- `doctor_any`: -0.0185, se 0.0283, t -0.65.
- `oop_any`: +0.0188, se 0.0297, t 0.63.
- `uninsured`: -0.0029, se 0.0213, t -0.13.

- `food_insecure`: +0.1072, se 0.0317, t 3.38.
- `very_low_food`: +0.0549, se 0.0271, t 2.03.
- `food_score`: +0.3854, se 0.1496, t 2.58.
- `snap_any`: +0.0000, se 0.0000, t 25.05.
- `doctor_any`: +0.0074, se 0.0243, t 0.30.
- `oop_any`: +0.0004, se 0.0252, t 0.02.
- `uninsured`: +0.0071, se 0.0203, t 0.35.