sipp/result/idea_scan/arpa400_diffdisc_estimates.csv

model,outcome,fpl_col,post_col,age_min,cutoff,bandwidth,coef_above_x_post,se_hc1,t_hc1,se_person_cluster,t_person_cluster,n_person_months,n_persons,n_person_clusters,n_states,min_cell_persons,min_cell_events,weighted_mean
monthly_fpl_age26_64_postyear_bw050,uninsured,monthly_fpl,post_year2021,26,4.0,0.5,-0.02625644247865165,0.007161402873544437,-3.66638254295787,0.014274671517150185,-1.8393727972728526,217096,23755,23723,52,5562,2965,0.10224295425674863
monthly_fpl_age26_64_postyear_bw050,any_coverage,monthly_fpl,post_year2021,26,4.0,0.5,0.026256442478396865,0.0071614028735443895,3.666382542922317,0.014274671517150464,1.8393727972549678,217096,23755,23723,52,5562,30705,0.8977570457432513
monthly_fpl_age26_64_postyear_bw050,direct_purchase,monthly_fpl,post_year2021,26,4.0,0.5,0.02219729015491279,0.006790525148131574,3.268862079248821,0.0136584344873004,1.6251708916971275,217096,23755,23723,52,5562,3669,0.10288975151769313
monthly_fpl_age26_64_postyear_bw050,marketplace_flag,monthly_fpl,post_year2021,26,4.0,0.5,0.019728255919010066,0.006117666837734061,3.2248006376099534,0.01228626060423909,1.6057168698019713,217096,23755,23723,52,5562,2840,0.07722828175378342
monthly_fpl_age26_64_postyear_bw050,market_or_subsidy,monthly_fpl,post_year2021,26,4.0,0.5,0.02179567526293003,0.00681205543775072,3.1995739703091384,0.013698595618227352,1.591088303528626,217096,23755,23723,52,5562,3679,0.10367101767677445
monthly_fpl_age26_64_postyear_bw050,private,monthly_fpl,post_year2021,26,4.0,0.5,0.023719118909460435,0.008551749070044263,2.773598560386392,0.01706148186813375,1.3902144662921314,217096,23755,23723,52,5562,28417,0.8370788149724089
monthly_fpl_age26_64_postyear_bw050,public,monthly_fpl,post_year2021,26,4.0,0.5,0.008149771884874698,0.006435258392817663,1.266424964997612,0.01318506469960882,0.6181063248871649,217096,23755,23723,52,5562,3177,0.088535707788396
monthly_fpl_age26_64_postyear_bw050,medicaid,monthly_fpl,post_year2021,26,4.0,0.5,0.003272526423166333,0.005750016372367277,0.5691334095834994,0.011723878163826739,0.279133438392724,217096,23755,23723,52,5562,2383,0.06425388908246504
monthly_fpl_age26_64_postyear_bw050,oop_any,monthly_fpl,post_year2021,26,4.0,0.5,-0.001600185732220627,0.011106534933487785,-0.1440760544853498,0.022832725949970708,-0.07008299121737936,217096,23755,23723,52,5562,22240,0.6511772877552806
monthly_fpl_age26_64_postyear_bw050,doctor_any,monthly_fpl,post_year2021,26,4.0,0.5,-0.014567244371985208,0.01010104349304258,-1.4421524253428737,0.020107494417907046,-0.7244684031349087,217096,23755,23723,52,5562,25134,0.7440180522989588
monthly_fpl_age21_64_postyear_bw050,uninsured,monthly_fpl,post_year2021,21,4.0,0.5,-0.031300869629616146,0.006797405612529355,-4.604825931223031,0.013721832301252575,-2.281099851858625,240936,26825,26790,52,6281,3295,0.10456988745930246
monthly_fpl_age21_64_postyear_bw050,any_coverage,monthly_fpl,post_year2021,21,4.0,0.5,0.03130086962956088,0.006797405612529419,4.604825931214857,0.013721832301252465,2.2810998518546155,240936,26825,26790,52,6281,34309,0.8954301125406975
monthly_fpl_age21_64_postyear_bw050,direct_purchase,monthly_fpl,post_year2021,21,4.0,0.5,0.021811473463018077,0.006666219991862589,3.2719402434427907,0.013161632252137907,1.6572012532469242,240936,26825,26790,52,6281,4188,0.10598516847693021
monthly_fpl_age21_64_postyear_bw050,marketplace_flag,monthly_fpl,post_year2021,21,4.0,0.5,0.01736721860491418,0.006043902450554223,2.873510740286951,0.01188324118454569,1.4614883544988109,240936,26825,26790,52,6281,3236,0.07919431518211871
monthly_fpl_age21_64_postyear_bw050,market_or_subsidy,monthly_fpl,post_year2021,21,4.0,0.5,0.022475949634374087,0.006693545744946976,3.3578540419091634,0.01323160198724752,1.6986567201791718,240936,26825,26790,52,6281,4225,0.10687932467368925
monthly_fpl_age26_64_postapr2021_bw050,uninsured,monthly_fpl,post_apr2021,26,4.0,0.5,-0.029642135025200213,0.007356959544653654,-4.029128452492487,0.014721869829972941,-2.013476234170364,217096,23755,23723,52,5273,2623,0.10224295425674863
monthly_fpl_age26_64_postapr2021_bw050,any_coverage,monthly_fpl,post_apr2021,26,4.0,0.5,0.02964213503057806,0.007356959544652389,4.0291284532241685,0.014721869829966596,2.0134762345365282,217096,23755,23723,52,5273,28035,0.8977570457432513
monthly_fpl_age26_64_postapr2021_bw050,direct_purchase,monthly_fpl,post_apr2021,26,4.0,0.5,0.02583491325763467,0.007002890532482619,3.6891785096169203,0.014143417016832258,1.8266387271822797,217096,23755,23723,52,5273,3322,0.10288975151769313
monthly_fpl_age26_64_postapr2021_bw050,marketplace_flag,monthly_fpl,post_apr2021,26,4.0,0.5,0.02695194592594965,0.006327302319099932,4.259626704510557,0.012697557381520131,2.122608712536726,217096,23755,23723,52,5273,2561,0.07722828175378342
monthly_fpl_age26_64_postapr2021_bw050,market_or_subsidy,monthly_fpl,post_apr2021,26,4.0,0.5,0.025338206450100008,0.007024876015472552,3.6069257869166176,0.014184187092611355,1.7863700108199265,217096,23755,23723,52,5273,3330,0.10367101767677445
annual_fpl_age26_64_postyear_bw050,uninsured,annual_fpl,post_year2021,26,4.0,0.5,-0.0301151434440888,0.006962061332087803,-4.325607317661734,0.022611661660608573,-1.3318412373271942,222233,15012,14990,52,2665,3233,0.10553180374333372
annual_fpl_age26_64_postyear_bw050,any_coverage,annual_fpl,post_year2021,26,4.0,0.5,0.030115143444112404,0.006962061332087724,4.325607317665173,0.022611661660608236,1.3318412373282578,222233,15012,14990,52,2665,31466,0.8944681962566663
annual_fpl_age26_64_postyear_bw050,direct_purchase,annual_fpl,post_year2021,26,4.0,0.5,-0.024270170156872634,0.006697523528555608,-3.6237528772230765,0.02296999086431714,-1.05660338744737,222233,15012,14990,52,2665,3754,0.10488932508187222
annual_fpl_age26_64_postyear_bw050,marketplace_flag,annual_fpl,post_year2021,26,4.0,0.5,-0.01916700253333636,0.006068280068890506,-3.1585560184668204,0.02083223329065439,-0.920064702901293,222233,15012,14990,52,2665,2922,0.07817377665576516
annual_fpl_age26_64_postyear_bw050,market_or_subsidy,annual_fpl,post_year2021,26,4.0,0.5,-0.024021864074132347,0.006700749938902813,-3.584951579026647,0.02298422478406604,-1.0451457162386288,222233,15012,14990,52,2665,3754,0.10567256544208062
monthly_fpl_age26_64_postyear_bw025,uninsured,monthly_fpl,post_year2021,26,4.0,0.25,-0.024367394929310605,0.010111888530428475,-2.4097768538473074,0.01701281955843279,-1.4322960897585226,109894,15833,15804,52,3775,1678,0.1010172440258551
monthly_fpl_age26_64_postyear_bw025,direct_purchase,monthly_fpl,post_year2021,26,4.0,0.25,0.014040463133011272,0.009254043185235655,1.5172247256650047,0.014373188943133847,0.9768509402166093,109894,15833,15804,52,3775,2085,0.1012525255733195
monthly_fpl_age26_64_postyear_bw025,market_or_subsidy,monthly_fpl,post_year2021,26,4.0,0.25,0.015671509419433016,0.009293352860740232,1.6863138260505857,0.014418058503792361,1.08693617905011,109894,15833,15804,52,3775,2089,0.10211494654138566
monthly_fpl_age26_64_postyear_bw075,uninsured,monthly_fpl,post_year2021,26,4.0,0.75,-0.018933843573139594,0.005827143205809859,-3.2492497445852906,0.012890328053877412,-1.4688410949668802,324603,30062,30018,52,7084,4330,0.10480208496869418
monthly_fpl_age26_64_postyear_bw075,direct_purchase,monthly_fpl,post_year2021,26,4.0,0.75,0.014718677514103233,0.005637573600616027,2.6108178015618098,0.012696171242422942,1.1593004877661304,324603,30062,30018,52,7084,5250,0.10603255726394455
monthly_fpl_age26_64_postyear_bw075,market_or_subsidy,monthly_fpl,post_year2021,26,4.0,0.75,0.01364847380813035,0.005652343383238794,2.41465758230523,0.012730263136262097,1.0721281769308235,324603,30062,30018,52,7084,5260,0.10694584544644924
placebo_cutoff_3.0_monthly_fpl_age26_64,uninsured,monthly_fpl,post_year2021,26,3.0,0.5,0.00788494787297154,0.007243224594286707,1.0885963524023554,0.01530004680252862,0.5153544936652353,248640,25871,25843,52,6216,5979,0.14808465985282476
placebo_cutoff_3.0_monthly_fpl_age26_64,direct_purchase,monthly_fpl,post_year2021,26,3.0,0.5,-0.05066294659349769,0.0076165708589917445,-6.6516740317182945,0.016112958841487966,-3.144236083012248,248640,25871,25843,52,6216,5870,0.13886199288457085
placebo_cutoff_3.0_monthly_fpl_age26_64,market_or_subsidy,monthly_fpl,post_year2021,26,3.0,0.5,-0.049984297160949105,0.007636666474017455,-6.545303154329542,0.016173416807103554,-3.0905217961732996,248640,25871,25843,52,6216,5929,0.14120498409529356
placebo_cutoff_3.5_monthly_fpl_age26_64,uninsured,monthly_fpl,post_year2021,26,3.5,0.5,-0.028360534610660335,0.0072019511314415025,-3.937896008048009,0.014949613542830652,-1.8970747658063123,236246,25274,25241,52,6155,4485,0.12463453900272681
placebo_cutoff_3.5_monthly_fpl_age26_64,direct_purchase,monthly_fpl,post_year2021,26,3.5,0.5,0.013909652027347895,0.00697983410466115,1.9928341875717355,0.014164454411889876,0.9820111402012,236246,25274,25241,52,6155,4923,0.11962232791868863
placebo_cutoff_3.5_monthly_fpl_age26_64,market_or_subsidy,monthly_fpl,post_year2021,26,3.5,0.5,0.013083271985424192,0.006999686162279775,1.8691226552310187,0.014213402996743113,0.9204883579549612,236246,25274,25241,52,6155,4991,0.1208763907614749
placebo_cutoff_4.5_monthly_fpl_age26_64,uninsured,monthly_fpl,post_year2021,26,4.5,0.5,0.002006815505318979,0.00676843918860985,0.29649605313675764,0.013208588832034652,0.15193261981566647,194435,22052,22015,52,5353,2585,0.08655217294450887
placebo_cutoff_4.5_monthly_fpl_age26_64,direct_purchase,monthly_fpl,post_year2021,26,4.5,0.5,-0.001567774695434336,0.007076751171007212,-0.22153876228648006,0.014158423821000849,-0.11073087762134183,194435,22052,22015,52,5353,2951,0.09366456825622473
placebo_cutoff_4.5_monthly_fpl_age26_64,market_or_subsidy,monthly_fpl,post_year2021,26,4.5,0.5,-0.0030774651598522926,0.007086976889529567,-0.4342423021583431,0.014158940353560443,-0.21735137538583002,194435,22052,22015,52,5353,2975,0.09422766952844318
placebo_cutoff_5.0_monthly_fpl_age26_64,uninsured,monthly_fpl,post_year2021,26,5.0,0.5,0.004754898187508357,0.006548176567552049,0.7261408024747131,0.01230696883491133,0.38635818870525446,173482,20301,20275,52,4887,2068,0.07611782694092703
placebo_cutoff_5.0_monthly_fpl_age26_64,direct_purchase,monthly_fpl,post_year2021,26,5.0,0.5,0.005806504441748385,0.006650622561773287,0.8730768266903677,0.013137633293839683,0.44197492134835964,173482,20301,20275,52,4887,2445,0.08548681708892993
placebo_cutoff_5.0_monthly_fpl_age26_64,market_or_subsidy,monthly_fpl,post_year2021,26,5.0,0.5,0.005883017891257704,0.006670425878285728,0.881955365160225,0.013143229472687227,0.4476082460161809,173482,20301,20275,52,4887,2466,0.08618303890691485

sipp/report/50_arpa_400fpl_cliff_diffdisc_test.md

## Main Estimates

- `uninsured`: -0.0263, HC1 se 0.0072, t -3.67; person-cluster se 0.0143, t -1.84.
- `any_coverage`: +0.0263, HC1 se 0.0072, t 3.67; person-cluster se 0.0143, t 1.84.
- `direct_purchase`: +0.0222, HC1 se 0.0068, t 3.27; person-cluster se 0.0137, t 1.63.
- `marketplace_flag`: +0.0197, HC1 se 0.0061, t 3.22; person-cluster se 0.0123, t 1.61.
- `market_or_subsidy`: +0.0218, HC1 se 0.0068, t 3.20; person-cluster se 0.0137, t 1.59.
- `private`: +0.0237, HC1 se 0.0086, t 2.77; person-cluster se 0.0171, t 1.39.
- `public`: +0.0081, HC1 se 0.0064, t 1.27; person-cluster se 0.0132, t 0.62.
- `medicaid`: +0.0033, HC1 se 0.0058, t 0.57; person-cluster se 0.0117, t 0.28.

- `uninsured`: -0.0313, HC1 se 0.0068, t -4.60; person-cluster se 0.0137, t -2.28.
- `any_coverage`: +0.0313, HC1 se 0.0068, t 4.60; person-cluster se 0.0137, t 2.28.
- `direct_purchase`: +0.0218, HC1 se 0.0067, t 3.27; person-cluster se 0.0132, t 1.66.
- `marketplace_flag`: +0.0174, HC1 se 0.0060, t 2.87; person-cluster se 0.0119, t 1.46.
- `market_or_subsidy`: +0.0225, HC1 se 0.0067, t 3.36; person-cluster se 0.0132, t 1.70.

- `uninsured`: -0.0296, HC1 se 0.0074, t -4.03; person-cluster se 0.0147, t -2.01.
- `any_coverage`: +0.0296, HC1 se 0.0074, t 4.03; person-cluster se 0.0147, t 2.01.
- `direct_purchase`: +0.0258, HC1 se 0.0070, t 3.69; person-cluster se 0.0141, t 1.83.
- `marketplace_flag`: +0.0270, HC1 se 0.0063, t 4.26; person-cluster se 0.0127, t 2.12.
- `market_or_subsidy`: +0.0253, HC1 se 0.0070, t 3.61; person-cluster se 0.0142, t 1.79.

- `uninsured`: -0.0301, HC1 se 0.0070, t -4.33; person-cluster se 0.0226, t -1.33.
- `any_coverage`: +0.0301, HC1 se 0.0070, t 4.33; person-cluster se 0.0226, t 1.33.
- `direct_purchase`: -0.0243, HC1 se 0.0067, t -3.62; person-cluster se 0.0230, t -1.06.
- `marketplace_flag`: -0.0192, HC1 se 0.0061, t -3.16; person-cluster se 0.0208, t -0.92.
- `market_or_subsidy`: -0.0240, HC1 se 0.0067, t -3.58; person-cluster se 0.0230, t -1.05.